<?xml version="1.0" encoding="UTF-8"?>
<energie-data xmlns:xsi="http://www.w3.org/2001/XMLSchema-instance"
    xsi:noNamespaceSchemaLocation="database.xsd">
    <energie-plant>
        <plant>
            <name>WWZ</name>
            <offer date="2023-03-02">
                <postalcode>6300</postalcode>
                <price>12</price>
            </offer>
            <offer date="2023-03-02">
                <postalcode>6400</postalcode>
                <price>14</price>
            </offer>
            <offer date="2023-03-02">
                <postalcode>6200</postalcode>
                <price>2</price>
            </offer>
        </plant>
        <plant>
            <name>EWZ</name>
            <offer date="2023-03-02">
                <postalcode>8300</postalcode>
                <price>12</price>
            </offer>
            <offer date="2023-03-02">
                <postalcode>8400</postalcode>
                <price>14</price>
            </offer>
            <offer date="2023-03-02">
                <postalcode>8200</postalcode>
                <price>2</price>
            </offer>
        </plant>
    </energie-plant>
</energie-data>